{"$comment":"Deployment block adapted from the unchanged MIT Onshape Export schema at 9961f6f1b56067c452447e90b63ad969e8d1db46; Copyright (c) 2026 The Onshape Export Authors. See LICENSE-MIT-service. New envelope authored 2026-10-12 under repository AGPL-3.0-only.","$defs":{"opaqueIdentity":{"maxLength":256,"minLength":1,"pattern":"^[!-~]+$","type":"string"},"sha256":{"pattern":"^[0-9a-f]{64}$","type":"string"}},"$id":"https://github.com/altendky/slicer-project-generators/handoffs/bambu-studio/v0.1.0-v1/handoff.schema.json","$schema":"https://json-schema.org/draft/2020-12/schema","additionalProperties":false,"properties":{"documentType":{"const":"generatorDeploymentHandoff","type":"string"},"handoffVersion":{"const":1,"type":"integer"},"immutableDeployment":{"additionalProperties":false,"properties":{"binaryIdentity":{"allOf":[{"$ref":"#/$defs/opaqueIdentity"},{"const":"734aa2340c954b7d06f1cea0d6c307b33279ffdd74b10cfe1639cdefc7e5e44c"}]},"binarySha256":{"allOf":[{"$ref":"#/$defs/sha256"},{"const":"734aa2340c954b7d06f1cea0d6c307b33279ffdd74b10cfe1639cdefc7e5e44c"}]},"buildIdentity":{"allOf":[{"$ref":"#/$defs/opaqueIdentity"},{"const":"79ba9c5c4abfc8e20a61e266a9df6ef44116f10d34c625c2e805b1b72af8e34f"}]},"capabilityIdentities":{"allOf":[{"items":{"$ref":"#/$defs/opaqueIdentity"},"maxItems":256,"type":"array","uniqueItems":true},{"const":["bambu-studio.named-objects@1","bambu-studio.support-blocking-volumes@1"]}]},"dialectIdentity":{"allOf":[{"$ref":"#/$defs/opaqueIdentity"},{"const":"bambu-studio-2.7.1.62-3mf-v1"}]},"inputKindIdentity":{"allOf":[{"$ref":"#/$defs/opaqueIdentity"},{"const":"raw-geometry-3mf-v1"}]},"inputSchemaIdentity":{"allOf":[{"$ref":"#/$defs/opaqueIdentity"},{"const":"raw-geometry-3mf-core-profile-v1"}]},"normalizationIdentity":{"allOf":[{"$ref":"#/$defs/opaqueIdentity"},{"const":"bambu-3mf-realize-meters-place-once-v1"}]},"packageIdentity":{"allOf":[{"$ref":"#/$defs/opaqueIdentity"},{"const":"0a65ae55eb5042b9f3b3987d2b4b81afdbcf05b9c94c2d44c30392b30651e2cd"}]},"packageSha256":{"allOf":[{"$ref":"#/$defs/sha256"},{"const":"a9c859962d23de9812a28871fa6a80334b7543ab695b52db73ca2d91387c3d9c"}]},"protocolVersion":{"allOf":[{"const":1},{"const":1}]},"provenanceSetIdentity":{"allOf":[{"$ref":"#/$defs/opaqueIdentity"},{"const":"BBL-MVP-PROVENANCE-SET-v1"}]},"settingsSchemaIdentity":{"allOf":[{"$ref":"#/$defs/opaqueIdentity"},{"const":"adfbdd411a8562cd84918ca9facf8c91f9cfeebed1a5cc606f46b2289920e465"}]},"validationIdentity":{"allOf":[{"$ref":"#/$defs/opaqueIdentity"},{"const":"bambu-3mf-semantic-readback-v1"}]}},"required":["packageIdentity","packageSha256","buildIdentity","binaryIdentity","binarySha256","protocolVersion","dialectIdentity","capabilityIdentities","inputKindIdentity","inputSchemaIdentity","settingsSchemaIdentity","provenanceSetIdentity","normalizationIdentity","validationIdentity"],"type":"object"},"interface":{"additionalProperties":false,"properties":{"argv":{"const":["--request","request.json","--result","result.json"],"type":"array"},"geometry":{"additionalProperties":false,"properties":{"maxFileByteLength":{"const":16777216,"type":"integer"},"maxTotalByteLength":{"const":67108864,"type":"integer"},"mediaType":{"const":"model/3mf","type":"string"},"roles":{"const":["rawGeometry","auxiliaryGeometry"],"type":"array"}},"required":["roles","mediaType","maxFileByteLength","maxTotalByteLength"],"type":"object"},"manifest":{"additionalProperties":false,"properties":{"manifestVersion":{"const":1,"type":"integer"},"maxByteLength":{"const":1048576,"type":"integer"},"maxObjects":{"const":256,"type":"integer"}},"required":["manifestVersion","maxByteLength","maxObjects"],"type":"object"},"output":{"additionalProperties":false,"properties":{"alsoBoundedByRequestMaxByteLength":{"const":true,"type":"boolean"},"candidateCommittedBeforeResult":{"const":true,"type":"boolean"},"maxByteLength":{"const":33554432,"type":"integer"},"mediaType":{"const":"model/3mf","type":"string"},"role":{"const":"generatedProject","type":"string"}},"required":["role","mediaType","maxByteLength","alsoBoundedByRequestMaxByteLength","candidateCommittedBeforeResult"],"type":"object"},"request":{"additionalProperties":false,"properties":{"maxByteLength":{"const":1048576,"type":"integer"},"protocolVersion":{"const":1,"type":"integer"}},"required":["protocolVersion","maxByteLength"],"type":"object"},"requiresAdjacentDescriptor":{"const":true,"type":"boolean"},"requiresFreshPrivateInvocationDirectory":{"const":true,"type":"boolean"},"requiresImmutableStagedInputs":{"const":true,"type":"boolean"},"result":{"additionalProperties":false,"properties":{"errorCategories":{"const":["malformedRequest","unsupportedRequest","invalidInput","generationFailed","internalError"],"type":"array"},"failureCreatesNoNewCandidate":{"const":true,"type":"boolean"},"failureExitCode":{"const":1,"type":"integer"},"maxByteLength":{"const":262144,"type":"integer"},"resultCommitFailureRemovesNewCandidate":{"const":true,"type":"boolean"},"structuredFailureWhenResultWritable":{"const":true,"type":"boolean"},"successExitCode":{"const":0,"type":"integer"}},"required":["maxByteLength","successExitCode","failureExitCode","structuredFailureWhenResultWritable","failureCreatesNoNewCandidate","resultCommitFailureRemovesNewCandidate","errorCategories"],"type":"object"},"settings":{"additionalProperties":false,"properties":{"identityScope":{"const":"per-invocation","type":"string"},"maxByteLength":{"const":1048576,"type":"integer"},"mediaType":{"const":"application/json","type":"string"},"schemaVersion":{"const":2,"type":"integer"}},"required":["schemaVersion","mediaType","maxByteLength","identityScope"],"type":"object"}},"required":["argv","requiresAdjacentDescriptor","requiresFreshPrivateInvocationDirectory","requiresImmutableStagedInputs","request","manifest","settings","geometry","output","result"],"type":"object"},"neutralContracts":{"additionalProperties":false,"properties":{"deployedGeneratorSchema":{"additionalProperties":false,"properties":{"sha256":{"const":"2af98b181a53c1a8c26b51d95bc974561871c2f913bb37e8275f5c3fe47f2b90","type":"string"},"url":{"const":"https://github.com/altendky/onshape-export/blob/9961f6f1b56067c452447e90b63ad969e8d1db46/config/deployed-generator/v1/deployed-generator.schema.json","type":"string"}},"required":["url","sha256"],"type":"object"},"protocolSchema":{"additionalProperties":false,"properties":{"sha256":{"const":"604676b76189003392332a94dd97a7dd7f0ef992321022639f18fff8c7ea403a","type":"string"},"url":{"const":"https://github.com/altendky/onshape-export/blob/9961f6f1b56067c452447e90b63ad969e8d1db46/protocol/generator/v1/generator-protocol.schema.json","type":"string"}},"required":["url","sha256"],"type":"object"},"settingsSchema":{"additionalProperties":false,"properties":{"sha256":{"const":"f7ef791c8f0666a599157a34e3f4984f80026a3d7a121ebc04644281652ae06c","type":"string"},"url":{"const":"https://github.com/altendky/onshape-export/blob/9961f6f1b56067c452447e90b63ad969e8d1db46/protocol/generator-settings/v2/generator-settings.schema.json","type":"string"}},"required":["url","sha256"],"type":"object"}},"required":["deployedGeneratorSchema","protocolSchema","settingsSchema"],"type":"object"},"release":{"additionalProperties":false,"properties":{"commit":{"const":"09dc4068e950a03eaf5c50fe56f5367be45cd79c","type":"string"},"correspondingSource":{"additionalProperties":false,"properties":{"byteLength":{"const":8076180,"type":"integer"},"name":{"const":"bambu-studio-v0.1.0-corresponding-source.tar.gz","type":"string"},"sha256":{"const":"bcc3c15220f739b9df9c6b5a6b2422c05ac4c126a37e2e8c5a8640b3184535ae","type":"string"},"url":{"const":"https://github.com/altendky/slicer-project-generators/releases/download/bambu-studio-v0.1.0/bambu-studio-v0.1.0-corresponding-source.tar.gz","type":"string"}},"required":["byteLength","name","sha256","url"],"type":"object"},"identities":{"additionalProperties":false,"properties":{"sha256":{"const":"f132eb51816f26107bce5650f018d894df75cd900a4c98d049c037a7f568de64","type":"string"},"url":{"const":"https://github.com/altendky/slicer-project-generators/blob/a729af8c8dce6ac48c6521907cd6c77d984533d1/provenance/bambu-studio/releases/v0.1.0/identities.json","type":"string"}},"required":["url","sha256"],"type":"object"},"package":{"additionalProperties":false,"properties":{"byteLength":{"const":1354728,"type":"integer"},"descriptorMember":{"const":"package.json","type":"string"},"descriptorSha256":{"const":"a93a499aa55a5096b2c0c264dd7db537e305148f664a9ed2253062cd7358d8c1","type":"string"},"executableMember":{"const":"slicer-project-generator-bambu-studio","type":"string"},"name":{"const":"bambu-studio-v0.1.0-x86_64-unknown-linux-gnu.tar.gz","type":"string"},"sha256":{"const":"a9c859962d23de9812a28871fa6a80334b7543ab695b52db73ca2d91387c3d9c","type":"string"},"url":{"const":"https://github.com/altendky/slicer-project-generators/releases/download/bambu-studio-v0.1.0/bambu-studio-v0.1.0-x86_64-unknown-linux-gnu.tar.gz","type":"string"}},"required":["byteLength","name","sha256","url","executableMember","descriptorMember","descriptorSha256"],"type":"object"},"provenanceSet":{"additionalProperties":false,"properties":{"sha256":{"const":"c17fa39484c78662dabf10e912a510f076c65f50920e8a026005edd0dc014eea","type":"string"},"url":{"const":"https://github.com/altendky/slicer-project-generators/blob/a729af8c8dce6ac48c6521907cd6c77d984533d1/provenance/bambu-studio/provenance-sets/mvp-v1.md","type":"string"}},"required":["url","sha256"],"type":"object"},"releaseReview":{"additionalProperties":false,"properties":{"sha256":{"const":"136233ec6f1641dd1235c571e8881535db21c875bc16962d643dc2bbb0cd2dd3","type":"string"},"url":{"const":"https://github.com/altendky/slicer-project-generators/blob/a729af8c8dce6ac48c6521907cd6c77d984533d1/provenance/bambu-studio/releases/v0.1.0/review.md","type":"string"}},"required":["url","sha256"],"type":"object"},"tag":{"const":"bambu-studio-v0.1.0","type":"string"},"url":{"const":"https://github.com/altendky/slicer-project-generators/releases/tag/bambu-studio-v0.1.0","type":"string"}},"required":["tag","commit","url","package","correspondingSource","identities","releaseReview","provenanceSet"],"type":"object"}},"required":["documentType","handoffVersion","immutableDeployment","release","neutralContracts","interface"],"type":"object"}