{"documentType":"generatorDeploymentHandoff","handoffVersion":1,"immutableDeployment":{"binaryIdentity":"734aa2340c954b7d06f1cea0d6c307b33279ffdd74b10cfe1639cdefc7e5e44c","binarySha256":"734aa2340c954b7d06f1cea0d6c307b33279ffdd74b10cfe1639cdefc7e5e44c","buildIdentity":"79ba9c5c4abfc8e20a61e266a9df6ef44116f10d34c625c2e805b1b72af8e34f","capabilityIdentities":["bambu-studio.named-objects@1","bambu-studio.support-blocking-volumes@1"],"dialectIdentity":"bambu-studio-2.7.1.62-3mf-v1","inputKindIdentity":"raw-geometry-3mf-v1","inputSchemaIdentity":"raw-geometry-3mf-core-profile-v1","normalizationIdentity":"bambu-3mf-realize-meters-place-once-v1","packageIdentity":"0a65ae55eb5042b9f3b3987d2b4b81afdbcf05b9c94c2d44c30392b30651e2cd","packageSha256":"a9c859962d23de9812a28871fa6a80334b7543ab695b52db73ca2d91387c3d9c","protocolVersion":1,"provenanceSetIdentity":"BBL-MVP-PROVENANCE-SET-v1","settingsSchemaIdentity":"adfbdd411a8562cd84918ca9facf8c91f9cfeebed1a5cc606f46b2289920e465","validationIdentity":"bambu-3mf-semantic-readback-v1"},"interface":{"argv":["--request","request.json","--result","result.json"],"geometry":{"maxFileByteLength":16777216,"maxTotalByteLength":67108864,"mediaType":"model/3mf","roles":["rawGeometry","auxiliaryGeometry"]},"manifest":{"manifestVersion":1,"maxByteLength":1048576,"maxObjects":256},"output":{"alsoBoundedByRequestMaxByteLength":true,"candidateCommittedBeforeResult":true,"maxByteLength":33554432,"mediaType":"model/3mf","role":"generatedProject"},"request":{"maxByteLength":1048576,"protocolVersion":1},"requiresAdjacentDescriptor":true,"requiresFreshPrivateInvocationDirectory":true,"requiresImmutableStagedInputs":true,"result":{"errorCategories":["malformedRequest","unsupportedRequest","invalidInput","generationFailed","internalError"],"failureCreatesNoNewCandidate":true,"failureExitCode":1,"maxByteLength":262144,"resultCommitFailureRemovesNewCandidate":true,"structuredFailureWhenResultWritable":true,"successExitCode":0},"settings":{"identityScope":"per-invocation","maxByteLength":1048576,"mediaType":"application/json","schemaVersion":2}},"neutralContracts":{"deployedGeneratorSchema":{"sha256":"2af98b181a53c1a8c26b51d95bc974561871c2f913bb37e8275f5c3fe47f2b90","url":"https://github.com/altendky/onshape-export/blob/9961f6f1b56067c452447e90b63ad969e8d1db46/config/deployed-generator/v1/deployed-generator.schema.json"},"protocolSchema":{"sha256":"604676b76189003392332a94dd97a7dd7f0ef992321022639f18fff8c7ea403a","url":"https://github.com/altendky/onshape-export/blob/9961f6f1b56067c452447e90b63ad969e8d1db46/protocol/generator/v1/generator-protocol.schema.json"},"settingsSchema":{"sha256":"f7ef791c8f0666a599157a34e3f4984f80026a3d7a121ebc04644281652ae06c","url":"https://github.com/altendky/onshape-export/blob/9961f6f1b56067c452447e90b63ad969e8d1db46/protocol/generator-settings/v2/generator-settings.schema.json"}},"release":{"commit":"09dc4068e950a03eaf5c50fe56f5367be45cd79c","correspondingSource":{"byteLength":8076180,"name":"bambu-studio-v0.1.0-corresponding-source.tar.gz","sha256":"bcc3c15220f739b9df9c6b5a6b2422c05ac4c126a37e2e8c5a8640b3184535ae","url":"https://github.com/altendky/slicer-project-generators/releases/download/bambu-studio-v0.1.0/bambu-studio-v0.1.0-corresponding-source.tar.gz"},"identities":{"sha256":"f132eb51816f26107bce5650f018d894df75cd900a4c98d049c037a7f568de64","url":"https://github.com/altendky/slicer-project-generators/blob/a729af8c8dce6ac48c6521907cd6c77d984533d1/provenance/bambu-studio/releases/v0.1.0/identities.json"},"package":{"byteLength":1354728,"descriptorMember":"package.json","descriptorSha256":"a93a499aa55a5096b2c0c264dd7db537e305148f664a9ed2253062cd7358d8c1","executableMember":"slicer-project-generator-bambu-studio","name":"bambu-studio-v0.1.0-x86_64-unknown-linux-gnu.tar.gz","sha256":"a9c859962d23de9812a28871fa6a80334b7543ab695b52db73ca2d91387c3d9c","url":"https://github.com/altendky/slicer-project-generators/releases/download/bambu-studio-v0.1.0/bambu-studio-v0.1.0-x86_64-unknown-linux-gnu.tar.gz"},"provenanceSet":{"sha256":"c17fa39484c78662dabf10e912a510f076c65f50920e8a026005edd0dc014eea","url":"https://github.com/altendky/slicer-project-generators/blob/a729af8c8dce6ac48c6521907cd6c77d984533d1/provenance/bambu-studio/provenance-sets/mvp-v1.md"},"releaseReview":{"sha256":"136233ec6f1641dd1235c571e8881535db21c875bc16962d643dc2bbb0cd2dd3","url":"https://github.com/altendky/slicer-project-generators/blob/a729af8c8dce6ac48c6521907cd6c77d984533d1/provenance/bambu-studio/releases/v0.1.0/review.md"},"tag":"bambu-studio-v0.1.0","url":"https://github.com/altendky/slicer-project-generators/releases/tag/bambu-studio-v0.1.0"}}